{
    "name": "work-order-info",
    "description": "Retrieves detailed information about a specific work order including status, tasks, deliverables, and related project information.",
    "category": "work_orders",
    "parameters": {
        "work_order_id": {
            "type": "integer",
            "description": "The ID of the work order to retrieve information for",
            "required": true
        },
        "include_task_summary": {
            "type": "boolean",
            "description": "Whether to include task summary statistics (default: true)",
            "required": false,
            "default": true
        },
        "include_deliverables": {
            "type": "boolean",
            "description": "Whether to include deliverable details (default: false)",
            "required": false,
            "default": false
        }
    },
    "required_permissions": [
        "can_create_work_orders"
    ],
    "implementation_class": "App\\Agents\\Tools\\WorkOrderInfoTool"
}
