{
    "name": "create-note",
    "description": "Creates a note or comment on an entity (task, work order, project). Notes are stored for human review and can be used for documentation or communication purposes.",
    "category": "general",
    "parameters": {
        "entity_type": {
            "type": "string",
            "description": "The type of entity to attach the note to (task, work_order, project, party, deliverable)",
            "required": true
        },
        "entity_id": {
            "type": "integer",
            "description": "The ID of the entity to attach the note to",
            "required": true
        },
        "content": {
            "type": "string",
            "description": "The content of the note",
            "required": true
        },
        "note_type": {
            "type": "string",
            "description": "The type of note (general, status_update, feedback, decision, blocker, question). Default: general",
            "required": false,
            "default": "general"
        },
        "agent_id": {
            "type": "integer",
            "description": "The ID of the AI agent creating the note (for activity logging)",
            "required": false
        },
        "team_id": {
            "type": "integer",
            "description": "The ID of the team (for activity logging)",
            "required": false
        }
    },
    "required_permissions": [],
    "implementation_class": "App\\Agents\\Tools\\CreateNoteTool"
}
